name,num_images,num_patients,modalities,body_regions,additional_data,paper_title,paper_link,paper_year,paper_authors,paper_journal,pmid,paper_citation_count,mesh_terms,pubmed_matches,mesh_terms_in_pubmed_matches,verified
Seaweed Metabolite Database (SWMD),,,,,,Seaweed metabolite database (SWMD): A database of natural compounds from marine algae.,https://doi.org/10.6026/97320630005361,2011,"Davis GD,Vasanthi AH",Bioinformation,21423723,63,,"[['database[ti]'], ['""X-ray""[tiab]']]",,
National Health Insurance Research Database (NHIRD),,372.0,,,,Validation of the National Health Insurance Research Database with ischemic stroke cases in Taiwan.,https://doi.org/10.1002/pds.2087,2011,"Cheng CL,Kao YH,Lin SJ,Lee CH,Lai ML",Pharmacoepidemiology and drug safety,21351304,1159,"Aspirin,Brain Ischemia,Cross-Sectional Studies,Databases, Factual,Drug Prescriptions,Humans,Insurance Claim Review,National Health Programs,Pharmacoepidemiology,Practice Patterns, Physicians',Reproducibility of Results,Stroke,Taiwan","[['database[ti]'], ['radiology[tiab]']]",,
National Cardiovascular Data Registry CathPCI dataset,,29784.0,,,,"Improvement in mortality risk prediction after percutaneous coronary intervention through the addition of a ""compassionate use"" variable to the National Cardiovascular Data Registry CathPCI dataset: a study from the Massachusetts Angioplasty Registry.",https://doi.org/10.1016/j.jacc.2010.09.057,2011,"Resnic FS,Normand SL,Piemonte TC,Shubrooks SJ,Zelevinsky K,Lovett A,Ho KK",Journal of the American College of Cardiology,21329835,50,"Adult,Age Factors,Aged,Aged, 80 and over,Angioplasty, Balloon, Coronary,Coronary Disease,Databases, Factual,Female,Follow-Up Studies,Hospital Mortality,Humans,Male,Massachusetts,Middle Aged,Myocardial Infarction,Percutaneous Coronary Intervention,Predictive Value of Tests,Quality Improvement,Radiography,Registries,Risk Assessment,Sex Factors,Shock, Cardiogenic,Survival Analysis","[['dataset[ti]'], ['""Radiography""[MeSH]']]","""Radiography""[MeSH]",
Danish Hernia Database,,14000.0,,,,Danish Hernia Database recommendations for the management of inguinal and femoral hernia in adults.,,2011,"Rosenberg J,Bisgaard T,Kehlet H,Wara P,Asmussen T,Juul P,Strand L,Andersen FH,Bay-Nielsen M,Danish Hernia Database",Danish medical bulletin,21299930,105,"Age Factors,Algorithms,Databases, Factual,Denmark,Female,Hernia, Femoral,Hernia, Inguinal,Humans,Laparoscopy,Male,Postoperative Pain,Sex Factors,Thromboembolism","[['database[ti]'], ['CT[tiab]', 'MRI[tiab]']]",,
MIMIC-II,,25328.0,,,"reports,captions,segmentation",Multiparameter Intelligent Monitoring in Intensive Care II: a public-access intensive care unit database.,https://doi.org/10.1097/CCM.0b013e31820a92c6,2011,"Saeed M,Villarroel M,Reisner AT,Clifford G,Lehman LW,Moody G,Heldt T,Kyaw TH,Moody B,Mark RG",Critical care medicine,21283005,505,"Adult,Artificial Intelligence,Critical Care,Databases, Factual,Decision Support Systems, Clinical,Expert Systems,Female,Humans,Intensive Care Units,Medical Informatics Applications,Medical Records Systems, Computerized,Monitoring, Physiologic,Quality Control,Retrospective Studies,United States","[['database[ti]'], ['radiology[tiab]']]",,
in vitro database,,,X-ray,pelvis,,Do early stages of lumbar intervertebral disc degeneration really cause instability? Evaluation of an in vitro database.,https://doi.org/10.1007/s00586-010-1635-z,2011,"Kettler A,Rohlmann F,Ring C,Mack C,Wilke HJ","European spine journal : official publication of the European Spine Society, the European Spinal Deformity Society, and the European Section of the Cervical Spine Research Society",21125299,95,"Adolescent,Adult,Aged,Aged, 80 and over,Biomechanical Phenomena,Databases as Topic,Female,Humans,Intervertebral Disc,Intervertebral Disc Degeneration,Joint Instability,Lumbar Vertebrae,Male,Middle Aged,Models, Statistical,Radiography,Range of Motion, Articular,Retrospective Studies,Severity of Illness Index,Young Adult","[['database[ti]'], ['""Radiography""[MeSH]']]","""Radiography""[MeSH]",
ModBase,,,,,,"ModBase, a database of annotated comparative protein structure models, and associated resources.",https://doi.org/10.1093/nar/gkq1091,2011,"Pieper U,Webb BM,Barkan DT,Schneidman-Duhovny D,Schlessinger A,Braberg H,Yang Z,Meng EC,Pettersen EF,Huang CC,Datta RS,Sampathkumar P,Madhusudhan MS,Sjölander K,Ferrin TE,Burley SK,Sali A",Nucleic acids research,21097780,233,"Bacterial Proteins,Computer Graphics,Databases, Protein,Models, Molecular,Peptides,Protein Interaction Mapping,Protein Structure, Tertiary,Proteins,Scattering, Small Angle,Sequence Alignment,Software,Structural Homology, Protein,User-Computer Interface,X-Ray Diffraction","[['database[ti]'], ['""X-ray""[tiab]']]",,
Australian Schizophrenia Research Bank,,786.0,,,genomics,"Australian Schizophrenia Research Bank: a database of comprehensive clinical, endophenotypic and genetic data for aetiological studies of schizophrenia.",https://doi.org/10.3109/00048674.2010.501758,2010,"Loughland C,Draganic D,McCabe K,Richards J,Nasir A,Allen J,Catts S,Jablensky A,Henskens F,Michie P,Mowry B,Pantelis C,Schall U,Scott R,Tooney P,Carr V",The Australian and New Zealand journal of psychiatry,21034186,104,"Adolescent,Adult,Aged,Australia,Brain,Databases, Factual,Female,Humans,Male,Marital Status,Middle Aged,Psychiatric Status Rating Scales,Radiography,Schizophrenia,Schizophrenic Psychology,Socioeconomic Factors,Young Adult","[['database[ti]'], ['""Radiography""[MeSH]', 'MRI[tiab]']]","""Radiography""[MeSH]",
oil palm EST database,,,,,,SSR mining in oil palm EST database: application in oil palm germplasm diversity studies.,https://doi.org/10.1007/s12041-010-0053-7,2010,"Ting NC,Zaki NM,Rosli R,Low ET,Ithnin M,Cheah SC,Tan SG,Singh R",Journal of genetics,20861564,28,"Africa,Alleles,Arecaceae,Asia,Base Sequence,DNA, Plant,Databases, Nucleic Acid,Expressed Sequence Tags,Genetic Variation,Genomic Library,Microsatellite Repeats,Phylogeny,Polymorphism, Genetic,Sequence Alignment,Sequence Analysis, DNA,South America","[['database[ti]'], ['CT[tiab]']]",,
An MRI-based atlas and database of the developing mouse brain,,,MRI,brain,segmentation,An MRI-based atlas and database of the developing mouse brain.,https://doi.org/10.1016/j.neuroimage.2010.07.043,2011,"Chuang N,Mori S,Yamamoto A,Jiang H,Ye X,Xu X,Richards LJ,Nathans J,Miller MI,Toga AW,Sidman RL,Zhang J",NeuroImage,20656042,126,"Aging,Animals,Brain,Brain Mapping,Cranial Nerves,Diffusion Tensor Imaging,Image Processing, Computer-Assisted,Imaging, Three-Dimensional,Magnetic Resonance Imaging,Mice,Mice, Inbred C57BL,Nerve Fibers","[['database[ti]'], ['MRI[tiab]']]",,
Phantom Database,,,CT,chest,,A resource for the assessment of lung nodule size estimation methods: database of thoracic CT scans of an anthropomorphic phantom.,https://doi.org/10.1364/OE.18.015244,2010,"Gavrielides MA,Kinnard LM,Myers KJ,Peregoy J,Pritchard WF,Zeng R,Esparza J,Karanian J,Petrick N",Optics express,20640011,39,"Humans,Lung Neoplasms,Phantoms, Imaging,Radiography, Thoracic,Solitary Pulmonary Nodule,Tomography, X-Ray Computed","[['database[ti]'], ['CT[tiab]']]",,
Central Line Emergency Access Registry Database,,1222.0,US,chest,,Ultrasound guidance for central venous catheter placement: results from the Central Line Emergency Access Registry Database.,https://doi.org/10.1016/j.ajem.2009.02.003,2010,"Balls A,LoVecchio F,Kroeger A,Stapczynski JS,Mulrow M,Drachman D,Central Line Emergency Access Registry  Investigators",The American journal of emergency medicine,20579550,39,"Catheterization, Central Venous,Emergency Treatment,Humans,Outcome Assessment, Health Care,Prospective Studies,Registries,Ultrasonography,United States","[['database[ti]'], ['Ultrasound[tiab]']]",,
Online mammographic images database,,,X-ray,chest,,Online mammographic images database for development and comparison of CAD schemes.,https://doi.org/10.1007/s10278-010-9297-2,2011,"Matheus BR,Schiabel H",Journal of digital imaging,20480383,25,"Adult,Breast Neoplasms,Databases, Factual,Diagnosis, Computer-Assisted,Female,Humans,Internet,Mammography,Middle Aged,Radiographic Image Enhancement,Radiographic Image Interpretation, Computer-Assisted","[['database[ti]'], []]",,
Benchmark Case,2.0,45.0,"CT,MRI",brain,,Results of a multi-institutional benchmark test for cranial CT/MR image registration.,https://doi.org/10.1016/j.ijrobp.2009.10.017,2010,"Ulin K,Urie MM,Cherlow JM","International journal of radiation oncology, biology, physics",20381270,135,"Benchmarking,Brain Neoplasms,Child,Glioma,Humans,Magnetic Resonance Imaging,Radiotherapy Planning, Computer-Assisted,Software,Tomography, X-Ray Computed","[['benchmark[ti]'], ['CT[tiab]', '""Computed Tomography""[tiab]', '""Magnetic Resonance""[tiab]']]",,
North American Contact Dermatitis Group (NACDG),,26479.0,,,,Positivity ratio and reaction index: patch-test quality-control metrics applied to the north american contact dermatitis group database.,,2010,"Warshaw EM,Nelsen DD,Sasseville D,Belsito DV,Maibach HI,Zug KA,Fowler JF,Taylor JS,DeLeo VA,Marks JG,Storrs FJ,Mathias CG,Pratt MD,Rietschel RL","Dermatitis : contact, atopic, occupational, drug",20233547,37,"Allergens,Bacitracin,Benzothiazoles,Dermatitis, Contact,Epoxy Resins,Ethylenediamines,Humans,Hydrocortisone,Lactones,Nickel,Patch Tests,Quality Control,Sesquiterpenes,Thimerosal,Thiourea","[['database[ti]'], ['PET[tiab]']]",,
Osteoarthritis Initiative,,,MRI,limbs,,Statistical shape modeling describes variation in tibia and femur surface geometry between Control and Incidence groups from the osteoarthritis initiative database.,https://doi.org/10.1016/j.jbiomech.2010.02.015,2010,"Bredbenner TL,Eliason TD,Potter RS,Mason RL,Havill LM,Nicolella DP",Journal of biomechanics,20227696,105,"Computer Simulation,Data Interpretation, Statistical,Databases, Factual,Female,Femur,Humans,Image Interpretation, Computer-Assisted,Magnetic Resonance Imaging,Male,Middle Aged,Models, Biological,Models, Statistical,Osteoarthritis, Knee,Surface Properties,Tibia","[['database[ti]'], ['MRI[tiab]']]",,
Epimedium sagittatum EST dataset,,,,,genomics,"Development of a EST dataset and characterization of EST-SSRs in a traditional Chinese medicinal plant, Epimedium sagittatum (Sieb. Et Zucc.) Maxim.",https://doi.org/10.1186/1471-2164-11-94,2010,"Zeng S,Xiao G,Guo J,Fei Z,Xu Y,Roe BA,Wang Y",BMC genomics,20141623,116,"Contig Mapping,DNA, Complementary,DNA, Plant,Epimedium,Expressed Sequence Tags,Gene Expression Profiling,Genetic Variation,Genome, Plant,Microsatellite Repeats,Plants, Medicinal,Sequence Analysis, DNA","[['dataset[ti]'], ['CT[tiab]']]",,
Perth Demyelinating Diseases Database,,26.0,,,,Longitudinally extensive myelopathy in Caucasians: a West Australian study of 26 cases from the Perth Demyelinating Diseases Database.,https://doi.org/10.1136/jnnp.2009.172973,2010,"Qiu W,Wu JS,Zhang MN,Matsushita T,Kira JI,Carroll WM,Mastaglia FL,Kermode AG","Journal of neurology, neurosurgery, and psychiatry",19710049,29,"Adult,Aquaporin 4,Australia,Catchment Area, Health,Databases, Factual,Demyelinating Diseases,Disability Evaluation,Female,Humans,Immunoglobulin G,Longitudinal Studies,Magnetic Resonance Imaging,Male,Spinal Cord,Spinal Cord Diseases,White People","[['database[ti]'], ['MRI[tiab]']]",,
Japanese Healthy Elderly Database,,91.0,PET,brain,,Construction of a (18)F-FDG PET normative database of Japanese healthy elderly subjects and its application to demented and mild cognitive impairment patients.,https://doi.org/10.1002/gps.2346,2010,"Iseki E,Murayama N,Yamamoto R,Fujishiro H,Suzuki M,Kawano M,Miki S,Sato K",International journal of geriatric psychiatry,19693778,29,"Adult,Aged,Aged, 80 and over,Cognition Disorders,Databases, Factual,Dementia,Female,Fluorodeoxyglucose F18,Humans,Japan,Male,Memory Disorders,Middle Aged,Positron-Emission Tomography,Psychiatric Status Rating Scales,Radiopharmaceuticals","[['database[ti]'], ['CT[tiab]', 'MRI[tiab]', 'PET[tiab]']]",,
Head CT-scan database for craniofacial reconstruction,85.0,,CT,brain,"segmentation,reports",Construction and analysis of a head CT-scan database for craniofacial reconstruction.,https://doi.org/10.1016/j.forsciint.2009.06.017,2009,"Tilotta F,Richard F,Glaunès J,Berar M,Gey S,Verdeille S,Rozenholc Y,Gaudy JF",Forensic science international,19665327,40,"Adult,Aged,Algorithms,Databases, Factual,Face,Facial Bones,Female,Forensic Anthropology,Humans,Image Processing, Computer-Assisted,Male,Mathematical Concepts,Middle Aged,Tomography, X-Ray Computed","[['database[ti]'], ['CT[tiab]']]",,
Circle of Willis artery diameters on MR angiography: an Australian reference database,171.0,,"MRI,MRI",brain,,Circle of Willis artery diameters on MR angiography: an Australian reference database.,https://doi.org/10.1111/j.1754-9485.2009.02056.x,2009,"El-Barhoun EN,Gledhill SR,Pitman AG",Journal of medical imaging and radiation oncology,19624291,28,"Adolescent,Adult,Aged,Aged, 80 and over,Australia,Circle of Willis,Databases, Factual,Female,Humans,Magnetic Resonance Angiography,Male,Middle Aged,Reference Values,Reproducibility of Results,Sensitivity and Specificity,Young Adult","[['database[ti]'], ['MRI[tiab]', '""Magnetic Resonance""[tiab]']]",,
national mammography database,48744.0,18269.0,X-ray,chest,reports,Probabilistic computer model developed from clinical data in national mammography database format to classify mammographic findings.,https://doi.org/10.1148/radiol.2513081346,2009,"Burnside ES,Davis J,Chhatwal J,Alagoz O,Lindstrom MJ,Geller BM,Littenberg B,Shaffer KA,Kahn CE,Page CD",Radiology,19366902,55,"Adolescent,Adult,Aged,Aged, 80 and over,Bayes Theorem,Breast Neoplasms,Diagnosis, Differential,Early Detection of Cancer,Female,Humans,Mammography,Middle Aged,Models, Statistical,ROC Curve,Registries,Retrospective Studies,Sensitivity and Specificity","[['database[ti]'], []]",,
National Mammography Database,,18269.0,X-ray,chest,reports,A logistic regression model based on the national mammography database format to aid breast cancer diagnosis.,https://doi.org/10.2214/AJR.07.3345,2009,"Chhatwal J,Alagoz O,Lindstrom MJ,Kahn CE,Shaffer KA,Burnside ES",AJR. American journal of roentgenology,19304723,50,"Adolescent,Adult,Aged,Aged, 80 and over,Breast Neoplasms,Female,Humans,Logistic Models,Mammography,Middle Aged,Predictive Value of Tests,ROC Curve,Registries,Retrospective Studies,Risk Assessment,Sensitivity and Specificity,United States","[['database[ti]'], []]",,
Craniomaxillofacial fibrous dysplasia dataset,,8.0,,limbs,,Craniomaxillofacial fibrous dysplasia: a 10-year database 1996-2006.,https://doi.org/10.1016/j.bjoms.2009.01.008,2009,"Kruse A,Pieles U,Riener MO,Zunker Ch,Bredell MG,Grätz KW",The British journal of oral & maxillofacial surgery,19282072,39,"Adolescent,Adult,Child,Female,Fibrous Dysplasia, Monostotic,Humans,Male,Mandibular Diseases,Maxillary Diseases,Plastic Surgery Procedures,Retrospective Studies,Skull,Tomography, X-Ray Computed,Treatment Outcome,Young Adult","[['database[ti]'], []]",,
Gynecologic Imaging Reporting and Data System (GI-RADS),187.0,171.0,US,pelvis,reports,Gynecologic imaging reporting and data system: a new proposal for classifying adnexal masses on the basis of sonographic findings.,https://doi.org/10.7863/jum.2009.28.3.285,2009,"Amor F,Vaccaro H,Alcázar JL,León M,Craig JM,Martinez J",Journal of ultrasound in medicine : official journal of the American Institute of Ultrasound in Medicine,19244063,67,"Adolescent,Adult,Artificial Intelligence,Database Management Systems,Female,Gynecology,Humans,Image Enhancement,Image Interpretation, Computer-Assisted,Information Storage and Retrieval,Middle Aged,Ovarian Neoplasms,Pattern Recognition, Automated,Radiology Information Systems,Reproducibility of Results,Sensitivity and Specificity,Ultrasonography,Young Adult","[['""Database Management Systems""[MeSH]'], ['""Radiology Information Systems""[MeSH]']]","""Database Management Systems""[MeSH],""Radiology Information Systems""[MeSH]",
Japanese 360-degree and 180-degree databases,,90.0,PET,chest,reports,The importance of population-specific normal database for quantification of myocardial ischemia: comparison between Japanese 360 and 180-degree databases and a US database.,https://doi.org/10.1007/s12350-009-9049-1,2009,"Nakajima K,Okuda K,Kawano M,Matsuo S,Slomka P,Germano G,Kinuya S",Journal of nuclear cardiology : official publication of the American Society of Nuclear Cardiology,19190975,49,"Databases, Factual,Female,Humans,Japan,Male,Middle Aged,Myocardial Ischemia,Reference Values,Reproducibility of Results,Sensitivity and Specificity,Tomography, Emission-Computed, Single-Photon,United States","[['database[ti]'], ['SPECT[tiab]']]",,
Australian PET Data Collection Project,,90.0,PET,"abdomen,pelvis",,The impact of PET-CT in suspected recurrent ovarian cancer: A prospective multi-centre study as part of the Australian PET Data Collection Project.,https://doi.org/10.1016/j.ygyno.2008.08.027,2009,"Fulham MJ,Carter J,Baldey A,Hicks RJ,Ramshaw JE,Gibson M",Gynecologic oncology,19150121,80,"Adult,Aged,Aged, 80 and over,Australia,Female,Fluorine Radioisotopes,Fluorodeoxyglucose F18,Humans,Middle Aged,Neoplasm Recurrence, Local,Ovarian Neoplasms,Positron-Emission Tomography,Prospective Studies,Radiopharmaceuticals,Tomography, X-Ray Computed","[['""data collection""[ti]'], ['CT[tiab]', 'PET[tiab]']]",,
Singapore Colorectal Cancer Database,,754.0,CT,chest,histology,How uncommon are isolated lung metastases in colorectal cancer? A review from database of 754 patients over 4 years.,https://doi.org/10.1007/s11605-008-0757-7,2009,"Tan KK,Lopes Gde L,Sim R",Journal of gastrointestinal surgery : official journal of the Society for Surgery of the Alimentary Tract,19082673,112,"Adult,Aged,Aged, 80 and over,Colonic Neoplasms,Female,Humans,Incidence,Liver Neoplasms,Lung Neoplasms,Male,Middle Aged,Neoplasm Staging,Rectal Neoplasms,Retrospective Studies,Young Adult","[['database[ti]'], ['CT[tiab]']]",,
Stratec XCT-2000 pQCT Scanner Database,,629.0,CT,limbs,reports,A reference database for the Stratec XCT-2000 peripheral quantitative computed tomography (pQCT) scanner in healthy children and young adults aged 6-19 years.,https://doi.org/10.1007/s00198-008-0800-2,2009,"Ashby RL,Ward KA,Roberts SA,Edwards L,Mughal MZ,Adams JE",Osteoporosis international : a journal established as result of cooperation between the European Foundation for Osteoporosis and the National Osteoporosis Foundation of the USA,19066709,44,"Adolescent,Aging,Anthropometry,Bone Density,Bone Development,Child,Databases, Factual,Female,Humans,Male,Radius,Reference Values,Sex Characteristics,Social Class,Tomography, X-Ray Computed,Young Adult","[['database[ti]'], ['""Computed Tomography""[tiab]']]",,
In Vivo 3D Digital Atlas Database of the Adult C57BL/6J Mouse Brain,,,MRI,brain,segmentation,In Vivo 3D Digital Atlas Database of the Adult C57BL/6J Mouse Brain by Magnetic Resonance Microscopy.,https://doi.org/10.3389/neuro.05.001.2008,2008,"Ma Y,Smith D,Hof PR,Foerster B,Hamilton S,Blackband SJ,Yu M,Benveniste H",Frontiers in neuroanatomy,18958199,169,,"[['database[ti]'], ['""Magnetic Resonance""[tiab]']]",,
bipolar disorder imaging studies,,,MRI,brain,,"Meta-analysis, database, and meta-regression of 98 structural imaging studies in bipolar disorder.",https://doi.org/10.1001/archpsyc.65.9.1017,2008,"Kempton MJ,Geddes JR,Ettinger U,Williams SC,Grasby PM",Archives of general psychiatry,18762588,372,"Bipolar Disorder,Brain,Databases, Factual,Humans,Magnetic Resonance Imaging,Tomography, X-Ray Computed","[['database[ti]'], ['""X-ray""[tiab]', '""Computed Tomography""[tiab]', '""Magnetic Resonance""[tiab]']]",,
RIDER,,,CT,chest,,The Reference Image Database to Evaluate Response to therapy in lung cancer (RIDER) project: a resource for the development of change-analysis software.,https://doi.org/10.1038/clpt.2008.161,2008,"Armato SG,Meyer CR,Mcnitt-Gray MF,McLennan G,Reeves AP,Croft BY,Clarke LP,RIDER Research Group",Clinical pharmacology and therapeutics,18754000,64,"Algorithms,Databases, Factual,Diagnosis, Computer-Assisted,Humans,Lung Neoplasms,Phantoms, Imaging,Predictive Value of Tests,Radiotherapy Planning, Computer-Assisted,Reference Standards,Software,Tomography, X-Ray Computed,Treatment Outcome,United States","[['database[ti]'], []]",,
High-resolution magnetic resonance histology of the embryonic and neonatal mouse,,,MRI,"brain,chest,abdomen,pelvis,limbs","segmentation,genomics",High-resolution magnetic resonance histology of the embryonic and neonatal mouse: a 4D atlas and morphologic database.,https://doi.org/10.1073/pnas.0805747105,2008,"Petiet AE,Kaufman MH,Goddeeris MM,Brandenburg J,Elmore SA,Johnson GA",Proceedings of the National Academy of Sciences of the United States of America,18713865,92,"Anatomy, Cross-Sectional,Animals,Animals, Newborn,Databases, Factual,Embryo, Mammalian,Embryonic Development,Heart Septal Defects,Imaging, Three-Dimensional,Magnetic Resonance Imaging,Mice,Mice, Mutant Strains,Mice, Transgenic,Microscopy,Time Factors","[['database[ti]'], ['""Magnetic Resonance""[tiab]']]",,
Alzheimer's Disease Neuroimaging Initiative,,504.0,MRI,brain,,Ventricular enlargement as a possible measure of Alzheimer's disease progression validated using the Alzheimer's disease neuroimaging initiative database.,https://doi.org/10.1093/brain/awn146,2008,"Nestor SM,Rupsingh R,Borrie M,Smith M,Accomazzi V,Wells JL,Fogarty J,Bartha R,Alzheimer's Disease Neuroimaging Initiative",Brain : a journal of neurology,18669512,371,"Aged,Aged, 80 and over,Alzheimer Disease,Apolipoproteins E,Cerebral Ventricles,Dilatation, Pathologic,Disease Progression,Female,Humans,Magnetic Resonance Imaging,Male,Middle Aged,Neuropsychological Tests,Observer Variation,Prognosis,Psychometrics,Radiology Information Systems,Reproducibility of Results","[['database[ti]'], ['""Radiology Information Systems""[MeSH]', 'MRI[tiab]']]","""Radiology Information Systems""[MeSH]",
KIGS (Pfizer International Growth Database),,22.0,,,,Growth hormone treatment completely normalizes adult height and improves body composition in Prader-Willi syndrome: experience from KIGS (Pfizer International Growth Database).,https://doi.org/10.1159/000145019,2008,"Lindgren AC,Lindberg A",Hormone research,18663319,56,"Absorptiometry, Photon,Body Composition,Body Height,Child,Child, Preschool,Databases, Factual,Female,Human Growth Hormone,Humans,Longitudinal Studies,Male,Prader-Willi Syndrome","[['database[ti]'], []]",,
Pancreatic Cancer Tissue Bank and Clinical Database,,7647.0,,,histology,Development of an integrated biospecimen bank and multidisciplinary clinical database for pancreatic cancer.,https://doi.org/10.1245/s10434-008-9833-1,2008,"Hwang RF,Wang H,Lara A,Gomez H,Chang T,Sieffert N,Moon Y,Ram S,Zimmerman S,Lee JH,Pisters PW,Tamm EP,Fleming JB,Abbruzzese JL,Evans DB",Annals of surgical oncology,18256882,51,"Adenocarcinoma,Adolescent,Adult,Aged,Aged, 80 and over,Ampulla of Vater,Biopsy, Fine-Needle,Carcinoma, Pancreatic Ductal,Common Bile Duct Neoplasms,Databases as Topic,Diagnostic Imaging,Duodenal Neoplasms,Endocrine Gland Neoplasms,Female,Follow-Up Studies,Humans,Male,Middle Aged,Pancreatic Neoplasms,Pancreaticoduodenectomy,Postoperative Complications,Prospective Studies,Risk Factors,Specimen Handling,Tissue Banks","[['database[ti]'], ['""Diagnostic Imaging""[tiab]']]",,
American College of Cardiology National Cardiovascular Database Registry,,105866.0,,,,Culprit-only or multivessel revascularization in patients with acute coronary syndromes: an American College of Cardiology National Cardiovascular Database Registry report.,https://doi.org/10.1016/j.ahj.2007.09.007,2008,"Brener SJ,Milford-Beland S,Roe MT,Bhatt DL,Weintraub WS,Brindis RG,American College of Cardiology National Cardiovascular Database Registry",American heart journal,18082505,102,"Acute Coronary Syndrome,Aged,Angioplasty, Balloon, Coronary,Cohort Studies,Confidence Intervals,Coronary Angiography,Coronary Disease,Coronary Restenosis,Coronary Vessels,Electrocardiography,Female,Follow-Up Studies,Humans,Length of Stay,Male,Middle Aged,Myocardial Revascularization,Odds Ratio,Patient Selection,Probability,Registries,Risk Assessment,Survival Rate,Treatment Outcome,United States","[['database[ti]'], []]",,
Canine Hearts Database,,9.0,MRI,chest,,A computational framework for the statistical analysis of cardiac diffusion tensors: application to a small database of canine hearts.,https://doi.org/10.1109/TMI.2007.907286,2007,"Peyrat JM,Sermesant M,Pennec X,Delingette H,Xu C,McVeigh ER,Ayache N",IEEE transactions on medical imaging,18041265,67,"Algorithms,Animals,Artificial Intelligence,Computer Simulation,Data Interpretation, Statistical,Databases, Factual,Diffusion Magnetic Resonance Imaging,Dogs,Heart,Humans,Image Enhancement,Image Interpretation, Computer-Assisted,Imaging, Three-Dimensional,Information Storage and Retrieval,Models, Cardiovascular,Models, Statistical,Pattern Recognition, Automated,Reference Values,Reproducibility of Results,Sensitivity and Specificity,Subtraction Technique","[['database[ti]'], ['MRI[tiab]', '""Magnetic Resonance""[tiab]']]",,
LIDC,265.0,,CT,chest,,The Lung Image Database Consortium (LIDC): a comparison of different size metrics for pulmonary nodule measurements.,https://doi.org/10.1016/j.acra.2007.09.005,2007,"Reeves AP,Biancardi AM,Apanasovich TV,Meyer CR,MacMahon H,van Beek EJ,Kazerooni EA,Yankelevitz D,McNitt-Gray MF,McLennan G,Armato SG,Henschke CI,Aberle DR,Croft BY,Clarke LP",Academic radiology,18035277,61,"Calibration,Databases as Topic,Diagnosis, Computer-Assisted,Humans,Image Processing, Computer-Assisted,Imaging, Three-Dimensional,Knowledge Bases,Lung Neoplasms,Observer Variation,Radiology,Radiology Information Systems,Solitary Pulmonary Nodule,Tomography, X-Ray Computed","[['database[ti]'], ['""Radiology""[MeSH]', '""Radiology Information Systems""[MeSH]', 'CT[tiab]']]","""Radiology""[MeSH],""Radiology Information Systems""[MeSH]",
