name,num_images,num_patients,modalities,body_regions,additional_data,paper_title,paper_link,paper_year,paper_authors,paper_journal,pmid,paper_citation_count,mesh_terms,pubmed_matches,mesh_terms_in_pubmed_matches,verified
Dataset of human medial temporal lobe single neuron activity during declarative memory encoding and recognition,,42.0,,brain,,Dataset of human medial temporal lobe single neuron activity during declarative memory encoding and recognition.,https://doi.org/10.1038/sdata.2018.10,2018,"Faraut MCM,Carlson AA,Sullivan S,Tudusciuc O,Ross I,Reed CM,Chung JM,Mamelak AN,Rutishauser U",Scientific data,29437158,30,"Amygdala,Hippocampus,Humans,Magnetic Resonance Imaging,Memory,Neurons,Temporal Lobe","[['dataset[ti]'], ['MRI[tiab]']]",,
GRASP cohort,,1009.0,,,,Clinical and serological features of systemic sclerosis in a multicenter African American cohort: Analysis of the genome research in African American scleroderma patients clinical database.,https://doi.org/10.1097/MD.0000000000008980,2017,"Morgan ND,Shah AA,Mayes MD,Domsic RT,Medsger TA,Steen VD,Varga J,Carns M,Ramos PS,Silver RM,Schiopu E,Khanna D,Hsu V,Gordon JK,Gladue H,Saketkoo LA,Criswell LA,Derk CT,Trojanowski MA,Shanmugam VK,Chung L,Valenzuela A,Jan R,Goldberg A,Remmers EF,Kastner DL,Wigley FM,Gourh P,Boin F",Medicine,29390428,80,"Adult,Black or African American,Chromosome Mapping,Cohort Studies,Cross-Sectional Studies,Databases, Factual,Female,Humans,Male,Prevalence,Prospective Studies,Retrospective Studies,Scleroderma, Systemic,Severity of Illness Index,Socioeconomic Factors,United States","[['database[ti]'], ['CT[tiab]', '""Computed Tomography""[tiab]']]",,
ADNI,,280.0,MRI,brain,,"Random forest feature selection, fusion and ensemble strategy: Combining multiple morphological MRI measures to discriminate among healhy elderly, MCI, cMCI and alzheimer's disease patients: From the alzheimer's disease neuroimaging initiative (ADNI) database.",https://doi.org/10.1016/j.jneumeth.2017.12.010,2018,"Dimitriadis SI,Liparas D,Tsolaki MN,Alzheimer's Disease Neuroimaging Initiative",Journal of neuroscience methods,29269320,60,"Aged,Alzheimer Disease,Brain,Cognitive Dysfunction,Databases, Factual,Decision Trees,Disease Progression,Female,Humans,Image Interpretation, Computer-Assisted,Machine Learning,Magnetic Resonance Imaging,Male,Pattern Recognition, Automated","[['database[ti]'], ['MRI[tiab]']]",,
fMRI Dataset,,,MRI,brain,,Alzheimer Classification Using a Minimum Spanning Tree of High-Order Functional Network on fMRI Dataset.,https://doi.org/10.3389/fnins.2017.00639,2017,"Guo H,Liu L,Chen J,Xu Y,Jie X",Frontiers in neuroscience,29249926,26,,"[['dataset[ti]'], ['""Magnetic Resonance""[tiab]']]",,
GAP3 cohort,,15101.0,,,genomics,The Movember Foundation's GAP3 cohort: a profile of the largest global prostate cancer active surveillance database to date.,https://doi.org/10.1111/bju.14106,2018,"Bruinsma SM,Zhang L,Roobol MJ,Bangma CH,Steyerberg EW,Nieboer D,Van Hemelrijck M,Movember Foundation's Global Action Plan Prostate Cancer Active Surveillance (GAP3) consortium",BJU international,29247473,56,"Aged,Aged, 80 and over,Charities,Cohort Studies,Databases, Factual,Disease Progression,Early Detection of Cancer,Global Health,Humans,Male,Men's Health,Middle Aged,Prognosis,Prostatic Neoplasms,Public Health Surveillance,Risk Assessment,Time Factors,Time-to-Treatment,Watchful Waiting","[['database[ti]'], ['MRI[tiab]', '""Magnetic Resonance""[tiab]']]",,
Consortium for Neuropsychiatric Phenomics (CNP) dataset,,265.0,MRI,brain,"segmentation,genomics",Preprocessed Consortium for Neuropsychiatric Phenomics dataset.,https://doi.org/10.12688/f1000research.11964.2,2017,"Gorgolewski KJ,Durnez J,Poldrack RA",F1000Research,29152222,65,,"[['dataset[ti]'], ['MRI[tiab]']]",,
KNOTTIN,,,,,,"KNOTTIN: the database of inhibitor cystine knot scaffold after 10 years, toward a systematic structure modeling.",https://doi.org/10.1093/nar/gkx1084,2018,"Postic G,Gracy J,Périn C,Chiche L,Gelly JC",Nucleic acids research,29136213,73,"Amino Acid Sequence,Computer Graphics,Cystine-Knot Miniproteins,Databases, Protein,Disulfides,Gene Expression,History, 21st Century,Humans,Internet,Ligands,Models, Molecular,Protein Conformation, alpha-Helical,Protein Conformation, beta-Strand,Sequence Alignment,Sequence Analysis, Protein,User-Computer Interface","[['database[ti]'], ['""Medical Imaging""[tiab]']]",,
A Novel Public MR Image Dataset of Multiple Sclerosis Patients With Lesion Segmentations Based on Multi-rater Consensus,,30.0,MRI,brain,segmentation,A Novel Public MR Image Dataset of Multiple Sclerosis Patients With Lesion Segmentations Based on Multi-rater Consensus.,https://doi.org/10.1007/s12021-017-9348-7,2018,"Lesjak Ž,Galimzianova A,Koren A,Lukin M,Pernuš F,Likar B,Špiclin Ž",Neuroinformatics,29103086,53,"Adult,Consensus,Databases, Factual,Female,Humans,Image Processing, Computer-Assisted,Magnetic Resonance Imaging,Male,Middle Aged,Multiple Sclerosis","[['dataset[ti]'], ['""Magnetic Resonance""[tiab]']]",,
DisProt,,,,,,A comprehensive assessment of long intrinsic protein disorder from the DisProt database.,https://doi.org/10.1093/bioinformatics/btx590,2018,"Necci M,Piovesan D,Dosztányi Z,Tompa P,Tosatto SCE","Bioinformatics (Oxford, England)",28968848,45,"Computational Biology,Databases, Protein,Protein Conformation,Sequence Analysis, Protein","[['database[ti]'], ['""X-ray""[tiab]']]",,
European Society of Thoracic Surgeons Database,,62774.0,,,reports,Report from the European Society of Thoracic Surgeons Database 2017: patterns of care and perioperative outcomes of surgery for malignant lung neoplasm.,https://doi.org/10.1093/ejcts/ezx272,2017,"Salati M,Brunelli A,Decaluwe H,Szanto Z,Dahan M,Varela G,Falcoz PE,ESTS DB Committee",European journal of cardio-thoracic surgery : official journal of the European Association for Cardio-thoracic Surgery,28950348,29,"Aged,Aged, 80 and over,Databases, Factual,Europe,Female,Humans,Lung Neoplasms,Male,Middle Aged,Morbidity,Neoplasm Staging,Pneumonectomy,Positron-Emission Tomography,Postoperative Complications,Practice Guidelines as Topic,Retrospective Studies,Risk Factors,Societies, Medical,Survival Rate,Thoracic Surgery,Tomography, X-Ray Computed,Treatment Outcome","[['database[ti]'], ['""Computed Tomography""[tiab]', '""Positron Emission Tomography""[tiab]']]",,
A multiscale imaging and modelling dataset of the human inner ear,,,"CT,MRI",limbs,"segmentation,genomics",A multiscale imaging and modelling dataset of the human inner ear.,https://doi.org/10.1038/sdata.2017.132,2017,"Gerber N,Reyes M,Barazzetti L,Kjer HM,Vera S,Stauber M,Mistrik P,Ceresa M,Mangado N,Wimmer W,Stark T,Paulsen RR,Weber S,Caversaccio M,Ballester MAG",Scientific data,28925991,30,"Ear, Inner,Humans,Image Processing, Computer-Assisted","[['dataset[ti]'], ['CT[tiab]', '""Computed Tomography""[tiab]']]",,
TB Portals,,1299.0,X-ray,chest,genomics,"The TB Portals: an Open-Access, Web-Based Platform for Global Drug-Resistant-Tuberculosis Data Sharing and Analysis.",https://doi.org/10.1128/JCM.01013-17,2017,"Rosenthal A,Gabrielian A,Engle E,Hurt DE,Alexandru S,Crudu V,Sergueev E,Kirichenko V,Lapitskii V,Snezhko E,Kovalev V,Astrovko A,Skrahina A,Taaffe J,Harris M,Long A,Wollenberg K,Akhundova I,Ismayilova S,Skrahin A,Mammadbayov E,Gadirova H,Abuzarov R,Seyfaddinova M,Avaliani Z,Strambu I,Zaharia D,Muntean A,Ghita E,Bogdan M,Mindru R,Spinu V,Sora A,Ene C,Vashakidze S,Shubladze N,Nanava U,Tuzikov A,Tartakovsky M",Journal of clinical microbiology,28904183,76,"Adolescent,Adult,Aged,Aged, 80 and over,Child,Databases, Factual,Europe, Eastern,Female,Humans,Information Dissemination,Internet,Male,Middle Aged,Mycobacterium tuberculosis,Transcaucasia,Tuberculosis, Multidrug-Resistant,Young Adult","[['""data sharing""[ti]'], ['CT[tiab]', '""X-ray""[tiab]', '""Computed Tomography""[tiab]']]",,
Japanese National Inpatient Database,,1590.0,,,,In-Hospital Mortality for Hepatic Portal Venous Gas: Analysis of 1590 Patients Using a Japanese National Inpatient Database.,https://doi.org/10.1007/s00268-017-4189-y,2018,"Koizumi C,Michihata N,Matsui H,Fushimi K,Yasunaga H",World journal of surgery,28879575,26,"Adult,Aged,Aged, 80 and over,Databases, Factual,Embolism, Air,Female,Hospital Mortality,Humans,Japan,Male,Middle Aged,Portal Vein,Retrospective Studies","[['database[ti]'], ['""Computed Tomography""[tiab]']]",,
Open access database of raw ultrasonic signals acquired from malignant and benign breast lesions,,78.0,US,chest,segmentation,Open access database of raw ultrasonic signals acquired from malignant and benign breast lesions.,https://doi.org/10.1002/mp.12538,2017,"Piotrzkowska-Wróblewska H,Dobruch-Sobczak K,Byra M,Nowicki A",Medical physics,28859252,42,"Access to Information,Adult,Aged,Breast Neoplasms,Databases, Factual,Female,Humans,Image Processing, Computer-Assisted,Middle Aged,ROC Curve,Ultrasonography, Mammary","[['database[ti]'], ['Ultrasound[tiab]']]",,
French Sarcoma Group (FSG) database,,214.0,,,,Prediction of local and metastatic recurrence in solitary fibrous tumor: construction of a risk calculator in a multicenter cohort from the French Sarcoma Group (FSG) database.,https://doi.org/10.1093/annonc/mdx250,2017,"Salas S,Resseguier N,Blay JY,Le Cesne A,Italiano A,Chevreau C,Rosset P,Isambert N,Soulie P,Cupissol D,Delcambre C,Bay JO,Dubray-Longeras P,Krengli M,De Bari B,Villa S,Kaanders JHAM,Torrente S,Pasquier D,Thariat JO,Myroslav L,Sole CV,Dincbas HF,Habboush JY,Zilli T,Dragan T,Khan R K,Ugurluer G,Cena T,Duffaud F,Penel N,Bertucci F,Ranchere-Vince D,Terrier P,Bonvalot S,Macagno N,Lemoine C,Lae M,Coindre JM,Bouvier C",Annals of oncology : official journal of the European Society for Medical Oncology,28838212,130,"Adult,Aged,Cohort Studies,Female,France,Humans,Incidence,Male,Middle Aged,Neoplasm Metastasis,Neoplasm Recurrence, Local,Prognosis,Solitary Fibrous Tumors,Survival Analysis","[['database[ti]'], ['MRI[tiab]']]",,
PPMI,,600.0,MRI,brain,,A test-retest study on Parkinson's PPMI dataset yields statistically significant white matter fascicles.,https://doi.org/10.1016/j.nicl.2017.07.020,2017,"Cousineau M,Jodoin PM,Morency FC,Rozanski V,Grand'Maison M,Bedell BJ,Descoteaux M",NeuroImage. Clinical,28794981,110,"Biomarkers,Brain,Data Mining,Databases, Factual,Diffusion Magnetic Resonance Imaging,Female,Humans,Male,Middle Aged,Neural Pathways,Parkinson Disease,Reproducibility of Results,White Matter","[['dataset[ti]'], ['MRI[tiab]']]",,
CFTR-France,,4615.0,,,genomics,"CFTR-France, a national relational patient database for sharing genetic and phenotypic data associated with rare CFTR variants.",https://doi.org/10.1002/humu.23276,2017,"Claustres M,Thèze C,des Georges M,Baux D,Girodon E,Bienvenu T,Audrezet MP,Dugueperoux I,Férec C,Lalau G,Pagin A,Kitzis A,Thoreau V,Gaston V,Bieth E,Malinge MC,Reboul MP,Fergelot P,Lemonnier L,Mekki C,Fanen P,Bergougnoux A,Sasorith S,Raynal C,Bareil C",Human mutation,28603918,77,"Alleles,Cystic Fibrosis,Cystic Fibrosis Transmembrane Conductance Regulator,Databases, Genetic,France,Genetic Counseling,Humans,Infant, Newborn,Mutation,Phenotype","[['database[ti]'], ['Ultrasound[tiab]']]",,
DEGRO Working Group Stereotactic Radiotherapy Study,,3.0,CT,chest,,Planning benchmark study for SBRT of early stage NSCLC : Results of the DEGRO Working Group Stereotactic Radiotherapy.,https://doi.org/10.1007/s00066-017-1151-8,2017,"Moustakis C,Blanck O,Ebrahimi Tazehmahalleh F,Ka Heng Chan M,Ernst I,Krieger T,Duma MN,Oechsner M,Ganswindt U,Heinz C,Alheit H,Blank H,Nestle U,Wiehle R,Kornhuber C,Ostheimer C,Petersen C,Pollul G,Baus W,Altenstein G,Beckers E,Jurianz K,Sterzing F,Kretschmer M,Seegenschmiedt H,Maass T,Droege S,Wolf U,Schoeffler J,Haverkamp U,Eich HT,Guckenberger M",Strahlentherapie und Onkologie : Organ der Deutschen Rontgengesellschaft ... [et al],28567503,46,"Benchmarking,Carcinoma, Non-Small-Cell Lung,Germany,Guideline Adherence,Humans,Lung Neoplasms,Neoplasm Staging,Prevalence,Radiosurgery,Radiotherapy Dosage,Radiotherapy Planning, Computer-Assisted,Reproducibility of Results,Sensitivity and Specificity,Treatment Outcome","[['benchmark[ti]'], ['CT[tiab]', '""Computed Tomography""[tiab]']]",,
The Society of Thoracic Surgeons General Thoracic Surgery Database (STS-GTSD),,3319.0,,,,Surgically Managed Clinical Stage IIIA-Clinical N2 Lung Cancer in The Society of Thoracic Surgeons Database.,https://doi.org/10.1016/j.athoracsur.2017.02.031,2017,"Boffa D,Fernandez FG,Kim S,Kosinski A,Onaitis MW,Cowper P,Jacobs JP,Wright CD,Putnam JB,Furnary AP",The Annals of thoracic surgery,28527969,37,"Aged,Databases, Factual,Female,Humans,Lung Neoplasms,Male,Middle Aged,Neoplasm Staging,Pneumonectomy,Prospective Studies,Registries,Societies, Medical,Thoracic Surgery,Treatment Outcome,United States","[['database[ti]'], ['""Positron Emission Tomography""[tiab]']]",,
Parkinson׳s disease cohort,,25.0,MRI,brain,segmentation,A dataset of multi-contrast population-averaged brain MRI atlases of a Parkinson׳s disease cohort.,https://doi.org/10.1016/j.dib.2017.04.013,2017,"Xiao Y,Fonov V,Chakravarty MM,Beriault S,Al Subaie F,Sadikot A,Pike GB,Bertrand G,Collins DL",Data in brief,28491942,82,,"[['dataset[ti]'], ['MRI[tiab]']]",,
European Society for Thoracic Surgeons Lung Neuroendocrine Tumours Retrospective Database,,400.0,,,,Adjuvant chemotherapy for large-cell neuroendocrine lung carcinoma: results from the European Society for Thoracic Surgeons Lung Neuroendocrine Tumours Retrospective Database.,https://doi.org/10.1093/ejcts/ezx101,2017,"Filosso PL,Guerrera F,Evangelista A,Galassi C,Welter S,Rendina EA,Travis W,Lim E,Sarkaria I,Thomas PA,ESTS Lung Neuroendocrine Working Group,
                    Contributors",European journal of cardio-thoracic surgery : official journal of the European Association for Cardio-thoracic Surgery,28459956,32,"Aged,Carcinoma, Large Cell,Carcinoma, Neuroendocrine,Chemotherapy, Adjuvant,Europe,Female,Humans,Lung Neoplasms,Male,Middle Aged,Retrospective Studies,Survival Analysis","[['database[ti]'], ['CT[tiab]']]",,
RESECT,,23.0,"MRI,US",brain,segmentation,REtroSpective Evaluation of Cerebral Tumors (RESECT): A clinical database of pre-operative MRI and intra-operative ultrasound in low-grade glioma surgeries.,https://doi.org/10.1002/mp.12268,2017,"Xiao Y,Fortin M,Unsgård G,Rivaz H,Reinertsen I",Medical physics,28391601,51,"Brain Neoplasms,Glioma,Humans,Magnetic Resonance Imaging,Magnetic Resonance Spectroscopy,Retrospective Studies,Ultrasonography, Interventional","[['database[ti]'], ['""Medical Image""[tiab]', 'MRI[tiab]', '""Magnetic Resonance""[tiab]', 'Ultrasound[tiab]']]",,
MRI Examinations,,34587.0,MRI,,,"Prevalence of Unanticipated Events Associated With MRI Examinations: A Benchmark for MRI Quality, Safety, and Patient Experience.",https://doi.org/10.1016/j.jacr.2017.01.043,2017,"Sadigh G,Applegate KE,Saindane AM",Journal of the American College of Radiology : JACR,28356198,31,"Appointments and Schedules,Benchmarking,Contrast Media,Foreign Bodies,Hospitals, University,Humans,Magnetic Resonance Imaging,Medical Order Entry Systems,Prevalence,Regression Analysis,Retrospective Studies","[['benchmark[ti]'], ['radiology[tiab]', 'MRI[tiab]']]",,
T<sub>1</sub>-weighted in vivo human whole brain MRI dataset,,1.0,MRI,brain,segmentation,T<sub>1</sub>-weighted in vivo human whole brain MRI dataset with an ultrahigh isotropic resolution of 250 μm.,https://doi.org/10.1038/sdata.2017.32,2017,"Lüsebrink F,Sciarra A,Mattern H,Yakupov R,Speck O",Scientific data,28291265,65,"Brain,Humans,Magnetic Resonance Imaging,Neuroimaging","[['dataset[ti]'], ['MRI[tiab]', '""Magnetic Resonance""[tiab]']]",,
International multicenter database,,130.0,"CT,MRI","chest,pelvis",reports,Imaging response during therapy with radium-223 for castration-resistant prostate cancer with bone metastases-analysis of an international multicenter database.,https://doi.org/10.1038/pcan.2017.6,2017,"Keizman D,Fosboel MO,Reichegger H,Peer A,Rosenbaum E,Desax MC,Neiman V,Petersen PM,Mueller J,Cathomas R,Gottfried M,Dresler H,Sarid D,Mermershtain W,Rouvinov K,Mortensen J,Gillessen S,Daugaard G,Omlin A",Prostate cancer and prostatic diseases,28244493,33,"Aged,Aged, 80 and over,Bone Neoplasms,Humans,Kallikreins,Male,Middle Aged,Prostate-Specific Antigen,Prostatic Neoplasms, Castration-Resistant,Radiopharmaceuticals,Radium,Retrospective Studies,Treatment Outcome","[['database[ti]'], ['CT[tiab]', '""Computed Tomography""[tiab]']]",,
Carotid Ultrasound Database,649.0,,US,limbs,segmentation,Automated segmental-IMT measurement in thin/thick plaque with bulb presence in carotid ultrasound from multiple scanners: Stroke risk assessment.,https://doi.org/10.1016/j.cmpb.2017.01.009,2017,"Ikeda N,Dey N,Sharma A,Gupta A,Bose S,Acharjee S,Shafique S,Cuadrado-Godia E,Araki T,Saba L,Laird JR,Nicolaides A,Suri JS",Computer methods and programs in biomedicine,28241970,26,"Automation,Carotid Intima-Media Thickness,Database Management Systems,Humans,Reproducibility of Results,Risk Assessment,Stroke","[['""Database Management Systems""[MeSH]'], ['Ultrasound[tiab]']]","""Database Management Systems""[MeSH]",
UNC-Wisconsin Rhesus Macaque Neurodevelopment Database,,34.0,MRI,brain,segmentation,The UNC-Wisconsin Rhesus Macaque Neurodevelopment Database: A Structural MRI and DTI Database of Early Postnatal Development.,https://doi.org/10.3389/fnins.2017.00029,2017,"Young JT,Shi Y,Niethammer M,Grauer M,Coe CL,Lubach GR,Davis B,Budin F,Knickmeyer RC,Alexander AL,Styner MA",Frontiers in neuroscience,28210206,44,,"[['database[ti]'], ['MRI[tiab]']]",,
ENC-DAT,123.0,,PET,brain,,[<sup>123</sup>I]FP-CIT ENC-DAT normal database: the impact of the reconstruction and quantification methods.,https://doi.org/10.1186/s40658-017-0175-6,2017,"Tossici-Bolt L,Dickson JC,Sera T,Booij J,Asenbaun-Nan S,Bagnara MC,Borght TV,Jonsson C,de Nijs R,Hesse S,Koulibaly PM,Akdemir UO,Koole M,Tatsch K,Varrone A",EJNMMI physics,28130765,45,,"[['database[ti]'], []]",,
HEDD,,,,,genomics,HEDD: the human epigenetic drug database.,https://doi.org/10.1093/database/baw159,2016,"Qi Y,Wang D,Wang D,Jin T,Yang L,Wu H,Li Y,Zhao J,Du F,Song M,Wang R",Database : the journal of biological databases and curation,28025347,37,"Databases, Genetic,Epigenesis, Genetic,Humans,Pharmacogenetics","[['database[ti]'], ['""X-ray""[tiab]']]",,
4D-Lung,609.0,20.0,CT,chest,"segmentation,reports",A longitudinal four-dimensional computed tomography and cone beam computed tomography dataset for image-guided radiation therapy research in lung cancer.,https://doi.org/10.1002/mp.12059,2017,"Hugo GD,Weiss E,Sleeman WC,Balik S,Keall PJ,Lu J,Williamson JF",Medical physics,27991677,86,"Carcinoma, Non-Small-Cell Lung,Cone-Beam Computed Tomography,Databases, Factual,Dose Fractionation, Radiation,Four-Dimensional Computed Tomography,Humans,Longitudinal Studies,Lung Neoplasms,Neoplasm Staging,Quality Assurance, Health Care,Radiotherapy, Image-Guided","[['dataset[ti]'], ['CT[tiab]', '""Computed Tomography""[tiab]']]",,
ADSORB database,,,CT,chest,,Predictors of aortic growth in uncomplicated type B aortic dissection from the Acute Dissection Stent Grafting or Best Medical Treatment (ADSORB) database.,https://doi.org/10.1016/j.jvs.2016.09.033,2017,"Kamman AV,Brunkwall J,Verhoeven EL,Heijmen RH,Trimarchi S,ADSORB trialists",Journal of vascular surgery,27876516,81,"Adult,Age Factors,Aged,Aorta, Thoracic,Aortic Aneurysm, Thoracic,Aortography,Blood Vessel Prosthesis,Blood Vessel Prosthesis Implantation,Computed Tomography Angiography,Databases, Factual,Dilatation, Pathologic,Disease Progression,Endovascular Procedures,Female,Humans,Logistic Models,Male,Middle Aged,Multivariate Analysis,Odds Ratio,Prosthesis Design,Randomized Controlled Trials as Topic,Retrospective Studies,Risk Factors,Stents,Thrombosis,Time Factors,Treatment Outcome","[['database[ti]'], ['""Computed Tomography""[tiab]']]",,
Danish Fetal Medicine database,,,,,,The Danish Fetal Medicine database.,https://doi.org/10.2147/CLEP.S99477,2016,"Ekelund CK,Kopp TI,Tabor A,Petersen OB",Clinical epidemiology,27822088,47,,"[['database[ti]'], ['Ultrasound[tiab]']]",,
Proteome-pI,,,,,,Proteome-pI: proteome isoelectric point database.,https://doi.org/10.1093/nar/gkw978,2017,Kozlowski LP,Nucleic acids research,27789699,177,"Computational Biology,Databases, Protein,Isoelectric Point,Proteome,Proteomics,Search Engine,Web Browser","[['database[ti]'], ['""X-ray""[tiab]']]",,
Normative values for the spine shape parameters using 3D standing analysis from a database of 268 asymptomatic Caucasian and Japanese subjects,,268.0,X-ray,pelvis,,Normative values for the spine shape parameters using 3D standing analysis from a database of 268 asymptomatic Caucasian and Japanese subjects.,https://doi.org/10.1007/s00586-016-4485-5,2016,"Le Huec JC,Hasegawa K","European spine journal : official publication of the European Spine Society, the European Spinal Deformity Society, and the European Section of the Cervical Spine Research Society",26951168,124,"Adolescent,Adult,Aged,Asian People,Databases, Factual,Female,Healthy Volunteers,Humans,Imaging, Three-Dimensional,Japan,Linear Models,Lordosis,Lumbar Vertebrae,Male,Middle Aged,Pelvic Bones,Postural Balance,Posture,Radiography,Reference Values,Sacrum,White People,Young Adult","[['database[ti]'], ['""Radiography""[MeSH]']]","""Radiography""[MeSH]",
Human Connectome Project dataset,,483.0,MRI,brain,,White matter integrity in brain networks relevant to anxiety and depression: evidence from the human connectome project dataset.,https://doi.org/10.1007/s11682-016-9642-2,2017,"De Witte NAJ,Mueller SC",Brain imaging and behavior,27744495,33,"Adult,Anxiety,Brain,Connectome,Depression,Diffusion Tensor Imaging,Female,Humans,Magnetic Resonance Imaging,Male,Neural Pathways,Neuropsychological Tests,Personality,White Matter,Young Adult","[['dataset[ti]'], []]",,
Prospective Comparison of Reduced-Iodine-Dose Virtual Monochromatic Imaging Dataset From Dual-Energy CT Angiography With Standard-Iodine-Dose Single-Energy CT Angiography for Abdominal Aortic Aneurysm,,66.0,CT,abdomen,,Prospective Comparison of Reduced-Iodine-Dose Virtual Monochromatic Imaging Dataset From Dual-Energy CT Angiography With Standard-Iodine-Dose Single-Energy CT Angiography for Abdominal Aortic Aneurysm.,https://doi.org/10.2214/AJR.15.15814,2016,"Agrawal MD,Oliveira GR,Kalva SP,Pinho DF,Arellano RS,Sahani DV",AJR. American journal of roentgenology,27610820,50,"Aged,Aged, 80 and over,Aortic Aneurysm, Abdominal,Aortography,Computed Tomography Angiography,Contrast Media,Dose-Response Relationship, Drug,Female,Humans,Iodine,Male,Middle Aged,Radiation Dosage,Radiation Exposure,Radiation Protection,Radiographic Image Enhancement,Radiography, Dual-Energy Scanned Projection,Reproducibility of Results,Sensitivity and Specificity,User-Computer Interface","[['dataset[ti]'], ['CT[tiab]']]",,
MASSIVE,,1.0,MRI,brain,"reports,segmentation","""MASSIVE"" brain dataset: Multiple acquisitions for standardization of structural imaging validation and evaluation.",https://doi.org/10.1002/mrm.26259,2017,"Froeling M,Tax CMW,Vos SB,Luijten PR,Leemans A",Magnetic resonance in medicine,27173617,57,"Adult,Brain,Brain Mapping,Databases, Factual,Diffusion Magnetic Resonance Imaging,Diffusion Tensor Imaging,Female,Humans,Image Processing, Computer-Assisted,Imaging, Three-Dimensional,Signal-To-Noise Ratio","[['dataset[ti]'], ['MRI[tiab]', '""Magnetic Resonance""[tiab]']]",,
eelsdb.eu,,,,,reports,A Complete Overhaul of the Electron Energy-Loss Spectroscopy and X-Ray Absorption Spectroscopy Database: eelsdb.eu.,https://doi.org/10.1017/S1431927616000179,2016,"Ewels P,Sikora T,Serin V,Ewels CP,Lajaunie L","Microscopy and microanalysis : the official journal of Microscopy Society of America, Microbeam Analysis Society, Microscopical Society of Canada",26899024,43,,"[['database[ti]'], ['""X-ray""[tiab]']]",,
National Mammography Database,,3181437.0,X-ray,chest,reports,The National Mammography Database: Preliminary Data.,https://doi.org/10.2214/AJR.15.14312,2016,"Lee CS,Bhargavan-Chatfield M,Burnside ES,Nagy P,Sickles EA",AJR. American journal of roentgenology,26866649,66,"Benchmarking,Breast Neoplasms,Databases, Factual,Early Detection of Cancer,Female,Humans,Mammography,Mass Screening,Population Surveillance,Registries,United States","[['database[ti]'], []]",,
Japanese Society of Nuclear Medicine working group normal database,,69.0,MRI,chest,,Comparison of phase dyssynchrony analysis using gated myocardial perfusion imaging with four software programs: Based on the Japanese Society of Nuclear Medicine working group normal database.,https://doi.org/10.1007/s12350-015-0333-y,2017,"Nakajima K,Okuda K,Matsuo S,Kiso K,Kinuya S,Garcia EV",Journal of nuclear cardiology : official publication of the American Society of Nuclear Cardiology,26860109,57,"Aged,Algorithms,Cardiac-Gated Single-Photon Emission Computer-Assisted Tomography,Databases, Factual,Female,Gated Blood-Pool Imaging,Humans,Image Enhancement,Image Interpretation, Computer-Assisted,Japan,Male,Middle Aged,Reproducibility of Results,Sensitivity and Specificity,Software,Ventricular Dysfunction, Left","[['database[ti]'], ['SPECT[tiab]']]",,
